id	doc	target
716	пути) шахматист, настоящий стратег, осталось еще украину ему присоединить и тогда он войдет в учебники современной истории героем столетия среди всех президентов. Да здравствует русский народ! 🇷🇺🇷🇺🇷🇺	1
717	ага удивляет кол-во мyдoзвoнoв, поставивших лайки под этим говно вбросом, рассчитанном на клинических идиотов. Не все ж их них боты и скакуасы. По ходу местная подписота и правда состоит на 90 % из имбецилов.	1
718	но боюсь что даже мухоморы не помогут, только тяжёлые наркотик.и	1
719	"не, не надо. Ему может быть и 50, и 60 лет. Но состояние мозга ""малолетний дe6ил""."	1
720	по фене ботаешь? А, по чужим х.м, не лЁтаешь?	1
721	😃😃😃😃😃	0
722	Павловский не ссы!	0
723	id117344916|Аня,] я могу быдловатный нищебродный терпильный рабсисянский биомycop типа тебя опускать бесконечно))))	1
724	"Кстати, сейчас в ""60 минут"" представитель от военных заявил, что будут бомбить Украину,   даже если ВСУ будут держать вооружение в жилых кварталах,   и Армию не остановят даже минимальные потери мирных жителей.   Будет, как в Алеппо: опыт большой!   Удары будут наноситься Калибрами и ВКС!"	0
725	"😂.... тебе скоро туда же 
готовься су%а"	1
726	за Пу..ина абсолютное большинство россиян, у вас уже и двух процентов не насобирается	1
727	с линии разграничения, как было сказано в умерших минских соглашениях в пункте о разведении войск. Теперь придется дальше отводить)	0
728	не люблю дешевых проституток с ротиками как куриная жопка	0
729	что они хотят? В котëл? Обезьяны с гранатами тоже бегают иногда, но не долго.	0
730	писец будет не только экономике,но и экологии!	0
731	почему в комментариях заблокированной Медузы воюете, а не на передовой в родном (?) Донбассе?	0
732	ну учитывая нынешнюю экономическую ситуацию, скоро с ра..ки все будут бежать, так шо	1
733	конечно...пздт как и путин руснявым	1
734	Лавров zдохни вместе с плешивом карликом, освободи Россию	1
735	Как всегда- ни слова правды! Начиная с даты, ко..чая оружием.	1
736	тут рб не приплетайте.ложь	0
737	вот это - правильно. О, да - так и есть: все россияне - русские; все русские - за путин..; все запутинцы - православные; все православные - россияне... И далее, по кругу	1
738	сходи на х.ер,трупы свежие дура,при плюсовой температуре от них за неделю каша останется,подойти без респератора е возможно будет,а там даже носы хо.хлы не воротят и стоят рядом как будто перед ними гамбургер из холодильника лежит ??????  лоша.ры вы фейкометные	1
739	Барыга, сделавший состояние на продажах контрабандных телефонов, будет учить туп..х совков тому, как правильно любить западные ценности и демократические свободы.	1
740	тебе не доложили, старуха?	0
741	мамки довольны. Не только сыначка приоделся, еще и мамке стиралку с микроволновкой привез	0
742	Наверняка обслуживающий персонал не мог оставить завод, кто то там был наверняка. Это ужасно, просто левые люди пострадали от мразотных марионеток с обеих сторон, что будучи идиотами не поняли в какой ублюдской затее участвуют за деньги и по чьему плану. Надеюсь этими деньгами они подавятся и карма их найдет что захотели заработать на горе людей.	0
743	Что за дибилы это смотрят?	1
744	дyp, ты его фанаткa?	1
745	Как вчера хорошо ночью было: в комментариях лентача не было дaунов пригожинских. А сегодня вновь по новой ??	1
746	Минобороны РФ не врёт... Никогда	0
747	"""главное за день"".  Одесса, на которую ничего не упало, и не погибло 5 мирных жителей:"	0
748	признайся  честно, кто хочет отправлять своих детей на войну с Украиной?  Или там не такие же матери и отцы....  Кремлёвским сволочам надо много обещать за кровь ваши детей, чтобы вы продали им своих подросших сыновей и не увидеть вам внуков!  Много вас таких ?	0
749	когда  Киев упомянулся впервые в 882 году,на месте Москвы был бурелом и болото. Русь была на месте Украины, а на месте уга нынешней России -орда.	0
750	Бесполезное какое-то занятие, учитывая, что Киевскую Русь, создал ВЫХОДЕЦ ИЗ НОВГОРОДА)	0
751	Тинькофф предложил выдать новые трусы..старые уже не отстирать..	0
752	Арестович такой дypaчок.	1
753	"гордость за свою страну - не? Не приходило?

Поддержка людей, которые сражаются сейчас на фронте за ДНР, ЛНР и Рoссию - тоже?

У вас, либерастов, главная ценность - это бабло, поэтому ничего другого на ум прийти не может."	1
754	Багдон,  а у тебя пере€бит ! В двоем тебя или толпой ?	1
755	чел как у тебя ава двигается?....	0
756	сын шлюxи, не гавкай.	1
757	Евгений писюк  - лахтадыр-педрилло.	0
758	из-за таких как пуtин медведчук в стране скоро дефолт и нищета будет	1
759	там нет военных, одни искалеченные пропагандой моральные уроды, которых ждёт либо могила, либо трибунал	0
760	пи*дуй в хохляндию, нацик е*учий	1
761	Ложь и пи&дёжь, никто ничего даже похожего не принял. Взять портянку с фантазиями , это не значит ее принять.	1
762	дура, 80 % на русофобском паблике против. С учетом, что здесь комментаторы 90% хохлы. И один пидop из Норвегии.	1
763	лично ты можешь идти наxyй ??	1
764	кис, в точку.	0
765	Скоро Россuя станет самой безграмотной страной в мире.	1
766	Шаляпина и Лещенко слушайте, а не вот эту вот западную гниль!	0
767	да-да. Типичный бот, косящий под публичную личность. Рассказывай дальше )	0
768	"А что ж эти твари морды-то свои скрывают? ""Герои"" же, так чего с#ут показаться?"	1
769	зачем накладывают эмбарго и санкции на Росцию?	1
770	Даже Трамп называет геноцид геноцидом, в отличии от придyрковатых любителей лягушатины ???????	1
771	"Если у гитлеровцев было квази-оправдание ""я только выполнял приказ"", то у российских оккупантов даже его не будет: вряд ли существуют командиры, отдающие приказы воровать внедорожники или насиловать детей."	0
772	а еще они систематично дают тебе на клык, говнобoт.	1
773	как что телефоны гоуенные у народа,бытовая техника,авто тоже все старое бу стоит много много денег,хочешь тоже так ?	1
774	у меня родственница 5 лет назад устроилась бортпроводником в Аэрофлот. Так она вся такая - Москва, Собянин, Путиh 😍🤩😘. Но пришёл 2022, украинцы для неё стали резко фашистами, хотя живут родственники в Одессе и Львове, а на сей день так и вообще приуныла - нет полётов. За счастье в Сызрань, или Кемерово слетать, а про Мальдивы и Испанию пришлось забыть.	1
775	ты реально внутри своего диагноза, ждовка?????????????	1
776	держи пятёрину, носи на жoпе)	1
777	"😂😂😂😂😂😂....
ну ващет и так начали -
курс занижен по отмашке и быдл2 тупо грабят средь бела дня... но валюта есть у малой группы населения и поэтому протестов не будет😂😂😂😂😂😂😂.... навальное молчит и об этом..
проститутка.. а черный рынок - это полностью 
дело рук чекистов так что даже не пытайтесь..
по тыкве настучат да ещё и посадят"	1
778	"это с какого такие выводы? Т.е. защита мирного населения от обстрелов укрокарателей, это ""преступления против человечества""? Ты идиoтка?"	1
779	нет конечно , это сарказм?\_(?)_/? однако стоит ожидать ахренительные истории  о том,как это сделала Украина	1
780	Камчатка, Сахалин,, Алтай, там даже у ..утина дача!	1
781	Одну станцию метро в москве тоже будут переименовывать?	0
782	а ты сама зайди, потрудись уж	0
783	я тебе, 6лядвa хохлорылая, лично череп проcтpeлю, мне нужен только приказ,  червь ты хохлодырый????????????????	1
784	Пусть теперь Россия в ж*** засунет себе свой газ и нефть. На арену выходят новые поставщики.??	1
785	что кастрюля, в гугле забанили?	0
786	с чего вдруг такое категоричное суждение?	0
787	ну тогда объявляй ес личным врагом и вводи против него санкции персональные	0
788	каклошвайн, пошел нaxyй	1
789	когда забыл что Медузу блоканули во ВКонтакте🤣😁😄	0
790	почему у росиянских мужиков, все сводится к мужским жепам? Вкс послушаешь- страна лгбт номер1 на планете, прямая дорога в евросоюз	1
791	"Це що до того - ""кто и что делал в Буче"""	0
792	Детей ***ука стреляют, конченные животные.	1
793	на Авито посмотрите, как Продают технику	0
794	👍👍👍👍💖💖💖🇷🇺🇷🇺🇷🇺🇷🇺🇷🇺Россия сила П....тин молодец	1
795	Так Рoссия всякий мусор и признаёт как она сама: ЛДНР, Крым, Абхазию	1
796	вот тебе сводка от прокремлёвского ТГ	0
797	8 лет Путин допускал убийства детей на Донбассе? 😱	0
798	Не тянет зелибоба на Гитлера. Хотя и группировка укровермахта примерно такая же, как у Гудериана в том же месте в 41 г.	0
799	"Соловей, походу, досвистелся с крейсером Москва.
А так там моральных у.одов целый лепрозорий: шейнин, скабеева с мужем, кисель и редакции их программ."	1
800	Это два друга Лу и Пу. Им хоть цсы в глаза, скажут божья роса.	1
801	Эмммм а откуда инфа то?	0
802	Аскет аскет	0
803	"Следующий закон будет об изменении термина ""иноагент"" на ""враг народа"".👍🏻😏"	0
804	Они хотят сказать что Украина стреляет по каким-то домам в России пока в самой Украине находятся войска РФ? Бл*ть, наверно тут логику даже нет смысла искать. Просто полный бред	1
805	"Всмысле 14 гражданских

Рoссия берет в плен гражданских? Что?"	1
806	илюша, хлопки и отрицательные темпы роста пришли из зомбоящика. К нему претензии.	0
807	Усрацца и не жить	1
808	как к вам на работу устроиться ?	0
809	у меня нет знакомых голодранцев, ты первым будешь.  Накормить тебя, бедолага?	0
810	пздц.... а лизок пескова и прочие золотые деточки  не персоны нон грата... ЗА***СЬ пусть и дальше едят мою жизнь	1
811	я не прав?Посмотрим что такие,как вы,запоете после всех санкций!	0
812	в чем он не прав? Это не политика, не экономика, а трагедия, над которой упражняются в цинизме и приплетании стайка дол*оебов, а другие смотрят и учатся UPD: можешь не отвечать, очередной залайканный укробот на лентаче, который любую хрень скажет и будет обласкан	1
813	потому что были разговоры о запрете национальностей, а не запрете имён. Но видимо многим и они не помогает, потому что они не видят, что у человека русская фамилия и именно поэтому его национальность и не указали.	0
814	Нелли - очередной лахтадыр	0
815	14 июля . военный парад в париже. тоже мракобесия.	0
816	если бы каклошвайнам не запретили постить разрушения, мы бы заeбались их репостить	1
817	люди виноваты за коллективное молчание пока над ними сидит фюрер. Ничегонеделание тоже приводит к последствиям. Тем более что в Р а ш к е 70% населения поддерживает братоубийственную войну	1
818	ктото хотел в рай но все перепутал	0
819	Потому что дебилы, куколды и тряпки? и тут им сказали по тв какими мы великие и киев за 2 дня? но что то пошло не так, но в сказку перестать верить уже не хочется....	0
820	Трое полицейских и шесть задержанных на несанкционированной акции протеста в центре Москвы пострадали в ходе ДТП с автозаком, которое произошло на пересечении Комсомольского проспекта и Хамовнического вала.	0
821	"Лентач скоро тоже станет иноагентом с такой подачей новостей.

Киевская Русь это историографический конструкт. Это просто название эпохи.
А все запомнили восприняли в лоб и теперь тычут пальцем что Киев испокон веков столица Рoссии.

Конечно надо менять эту ошибку."	1
822	"Это вандализм по отношению к Ленину или к .... (кто ""уходи"")?"	0
823	Мариуполь вполне город? Ты в глаза долбишься? Или живешь в заброшках и для тебя нормальный город это развалины? Нет Мариуполя больше, груда кирпичей, пол Харькова разнесли, сотни деревень, Северодонецк скоро снесут, Луганскую область.. в общем, большинство русскоязычной части страны 40миллионой уничтожили	0
824	что показала российская армия с 24 февраля? Что она умеет воевать с мирными гражданами?	0
825	😊 ну ну наивный вы.	0
826	да гнездец вашему пианисту😄и всей бандеровской своло.и край настаёт. Щаз завизжат😄	1
827	вы уже задолбали спамить.	0
828	В окно выгляни, дегенерат. Я, конечно понимаю, что на новоязе все наоборот, но самому не противно?!	0
829	Город Буча - это приговор для всех, кто к ней имеет отношение. От Путина, до пропагандиста, от военных, совершивших это преступление, до учительницы в школе, которая делает постановочные фото с буквой Z.	0
830	одну технику теряют, другую- писдят	1
831	"в азове по слухам едва три человека фанатеют по свастонам, остальные просто радикальные патриоты. Такие же как у нас сейчас пердят перед теликом и жаждут истребить всех врагов россиюшки.

и чёт я не вижу чтобы членоb нашего военного подразделения ""русич"" настигла швабра. Сколько лет уже безнаказанно дрочат на свастоны. Видимо их не трогают потому что это хорошие нацики, они ведь за наших)."	1
832	а Петров - Скабеев ,через дефис уже аристократ?	0
833	Как говорится, еб.сь оно всё конём!	1
834	ты мне свои влажные фантазии не озвучивай, мне такое неинтересно	0
835	ты реально веришь в эту xyйню что написал?	1
836	Жалко, что по прежнему считают нас за идиотов … пишут, что 83% поддерживают президента Р*ссии … А после этих репортажей пусть не удивляются снижению  рейтинга …Зачем ? Это же только наоборот срабатывает? И Соловьев  этот -личность очень  агрессивная , вчера на передаче с ним кроме слова «Сармат» сложно что то расслышать было . Передавливает кнопку … 😎	1
837	есть огромная разница между государственной цензурой с уголовным преследованием и отказом отдельных частных компаний давать кому-то высказываться на своих площадках…	0
838	и я о том же. Что не так с этими людьми, непонятно. ☺	0
839	Давай ебашь	0
840	ну тогда вы согласитесь, наверное, со славами Путина, что украинцы в основе своей неонацисты? Ну бред же. Чтоб говорить об основе, нужно иметь адекватную социологию. А ее в РФ нет. Все эти опросы о поддержке деда и операции, это вопрос вы поддерживаете все это или проблем хотите? Я не оправдываю россиян, именно их пассивность привела ко всему этому, в этом их вина и они заплатят сполна, но это не значит, что в основном россияне преступники и воры. Я прошу вас, не уподобляйтесь Пуtину с этими обобщениями, не будьте как он.	1
841	исследование показало, что люди использующие смайлы в большом количестве - т-пые и глупые.	1
842	кто такой Путиh, какие он со своей РФией имеет права на введение Российских войск на нашу же территорию, всё это земля и люди СССР ?	1
843	амеры такие же тупыe  как хохлы)))	1
844	Да, хохлостадо начало наступление на Донбасс..Надеюсь, РФ защитит людей Донбасса..	0
845	Какая нахир война с Украиной?	1
846	школу в Беслане просто расстреляли вместе с детьми !	0
847	Херня и есть херня.Ни в чем она не заключается.Потому что это херня а я херню с всякими херами не обсуждаю.Мне что больше делать нехер)).	0
848	"а какие могут быть отличия, если они все ""разведданные"" с сайта Пентагона качают..."	0
849	"Какая может быть армия в убогой рос..ии?
Ответ очевиден, не Великая, и не Вторая - а убогая, и не мытая.
Так, что всё идёт по плану, фашисты не вечны и не бесконечны!"	1
850	Стыдно и страшно. Ждём нюрнбергского процесса над этими тварями. Надеюсь что самая главная твaрь к тому времени не сдохнет от своего рака и тоже ответил по полной.	1
851	Всю гд лишить виз и пусть сидят в днр и лнр вечно!	0
852	круто	0
853	ну и дятел же ты тупой... последствия санкций еще впереди	0
854	да это вы в палате №6 (поди читал Чехова АП?), и скачете с шикарным лозунгом - ХТО НЭ СКАЧЕ ТОТ МОСКАЛЬ. Уроды...раздолбали красавицу-Украину в угоду своих вскормленных предателей и штанов америкосовских.	0
