id	doc	target
0	"Представляю, как им всем скучно... Бабок жапой жри, целей никаких в жизни и тут раз, и решили ""а не начать ли нам СПЕЦОПЕРАЦИЮ?"")"	1
1	да я даже это не смотрю, но уж точно кому не верю так нашим пропагандонам))	0
2	Европа вырождается из за своих извращений. Арабы и негры нарожают от украинок новое европейское потомство))	0
3	найди себе наконец парня и прекрати истерить, недотрахaннaя сyчкa.)	1
4	пхер, вернуть Крым грекам! https://gosvon.net/?usr=138280294	1
5	дypa, проснись, ты проебалa последние два месяца.	1
6	Опять согнал студентов насильно,как всегда ложь	0
7	рыжaя дyрa, ты самостоятельно проверяла «свежесть» трупов и дату фотографий?	1
8	Не поняла кто стрелял молодой или старый	0
9	Канал дождь принадлежит медведеву маргинальному п!дарасу	1
10	Жаль что Украина скоро прекратит свое существование, а такую страну Ленин создал и на все просрали	0
11	посмотрим) Пи*деть не мешки ворочать)	1
12	путин будет минимум до 2031... поэтому никакие договора никому уже не помогут...	0
13	я довольная пенсионерка,тебе бы ,идиот,на эту прибавку пожить.	0
14	"Протоирей Андрей Ткачёв о ""новой сексуальности"". Либерасты, отвлекитесь на пять минут,сделайте паузу в разжигании ненависти украинцев к русским. Это ????????????вас pidarов напрямую касается"	1
15	Не перекручивайте и не разводите демогогию.	0
16	а сейчас этот пи*арас сидит кончает от счастья и БОЛЬШЕ НЕ ПРИЗЫВАЕТ К МИТИНГАМ ... типа страшно что завалят  как проститутку тесачка....	1
17	О, прям как в твиттере. Но лентач об этом не скажет, конечно	0
18	мамку твою лично на твоей спине еб&л жиес????????	1
19	так забавно блеянье и попытка убедить типа это всё пу, палятся ребятки своими повторами постоянно, пытаясь убелить всех вынуждены это повторять что мол это всё он сам. 🤦🏻‍♂️🤣🤣	0
20	как я понял, снегурочки у него нет?	0
21	мммммддддддаааааа бл№ядь	1
22	Было время , спросишь у знакомых ты за путина,за олигархов пойдешь воевать ? Все в один голос ты что дурак,прошло буквально год и процентов 80 готовы жoпу отдать за деньги!	1
23	id692756807|Евгений],??плюс в этом геноциде только в том, что подобные тебе безмозглые питухи, будут уничтожены до последнего генома ДНК. Если тебе насрать на своё поколение при жизни, то ты ничем не отличаешся от раковой опухоли в организме.	1
24	шмеркель - плоть от плоти чекистская цука	1
25	Скажут, что украинцы переоделись в форму РФ и на трофейной технике произвели захват с целью выкупа за 1000...000$	0
26	Розебашили их нах. там.Ждём пленных.Потом привезём в бучу и будем их еб.ть палкой.??	1
27	даешь пенсию в 100 лет, да здравствует политика путuна	1
28	"Илон купил твиттер.
***ипец Рогозину.😅"	1
29	какой ещё бумеранг? Адепты Украины поджигают.	0
30	шлюxoбот, ну-ка нaxyй отсюда!	1
31	прочую нелюдь ? Кто ты кнопочница?	0
32	кому ты трешь, чух. ка позорная бункерботоскотская-твое место у параши, максимум лес рубить-грехи до смерти искупать.	1
33	ну да.. нам это очень важно знать	0
34	ну, бл) я до пандемии был и в Испании и в Италии и в Черногории и видел, что там все довольно убого, по сравнению с нами, а про Германию мне рассказывает чел который там живет и которому я доверяю) все, peace) не будем спорить)	1
35	Да как бы работает юни пэй в Рассии , пользуемся без проблем пока.	1
36	"ага, я и забыла ,что Катар - оказывается имеет бесконечные запасы сжиженного.А у арабов нефти - хоть .опой жуй.""МНОГО КТО"" - это кто?"	1
37	ватнорырый не гавкай	0
38	а своей чупакабре, которая тебя выср@ла, в пасть ссал? ??	1
39	минские договоренности можно тоже разорвать как и ваш контракт 🤣 больше никаких договоров с вами вести не будут	0
40	да все **** эту К*********ю во все дыхательные и пихательные	1
41	Не надоело всякий бред из пальца высасывать.. Журналистика уровня спидинфо.	0
42	уда, быдло путинское , лезешь со своими куриными мозгами? Если бы вас, уродов, быдло меньше в Рoссии, то у нас никогда бы не было у власти Путина и его шайки, усохни, гниль!	1
43	Лишняя хромосома не даёт скрепоносным покоя. Zalupi тупые, фанаты насильников и убийц	1
44	Боже мой, как страшно! Несчастные люди, рыдаю  горькими слезами(((	0
45	Бездарностям по обе стороны нужна война. Война ради войны.	0
46	уж извините, но на похороны...так оно все устроено, эти деньги даются как поддержка, а не чтобы откупиться, как многие по туnой логике сначала предполагают	1
47	ему еще показания давать.	0
48	Хахах какой бред . Это типа соловьева так про пиарили ?	0
49	⚡️Минимум 6 убитых и 2 тяжело раненых: этой ночью оккупанты 12 раз обстреляли мирные жилые дома Луганщины, — глава ОВА Гайдай  Пострадали по меньшей мере 7 домов и отделение нацполиции. Принявшие удар города: Горское, Золотое, Лисичанск и Северодонецк.	0
50	Ну че педики? Одесса наш? 3х месячных детей на Пасху будем есть? Или опять будете пи@деть про дамбас или гэто не мы, а нацики не умеют стрелять? Когда ж вы далба&обы протрезвеете?!	1
51	леса Роцсии горят из-за диверсии Украинцев!	1
52	ага, а потом О-ляска в РФ , а потом Индия войдёт в состав Англии и т. д. и т. п.	0
53	👏👏👏	0
54	"А кто мешал режиму Порошенко вступить в ЕС?! 
Причём здесь П.тин?"	1
55	Может американские истерички психанут и против себя санкции введут за покупку нефти у Ро***сии? Или этодругоепониматьнадо?	1
56	пруфы, что Роcсия большой рынок для этих стран от тебя будет, а не просто блабла?	1
57	нас0сала на эпл, ещё раз с0сни	1
58	2 дня назад Песков кричал на весь мир,что Донбасс это Украина,вы помните??И Россия никогда ни на кого не нападала	0
59	Айтюнс работает без изменений, все релизы доступны, а в яндекс.музыке многие релизы действительно не появляются. Так что остался только айтюнс. Про вк и так всё понятно.	0
60	Рифмуем немного: мешаем с фантой 5 озёр, получаем фантазер	0
61	ага, с чистой совестью, как крыса сидеть с закрытой страницей и абсирать воинов за их скрытые лица)	1
62	ну в 862 году там и правда ничего не произошло, пикчер учи историю	0
63	Ваня,а ты тварь дрожащая или ординарная?	0
64	и существуют сотни определений этого понятия.	0
65	как раз во время Ярослава это едва ли было, ещё ни лестничного права, ни междоусобицы нет, всё под контролем и властью русского князя	0
66	Болгария отказалась поставлять оружие Украине, потому что у Болгарии мало оружия ,, а она боится что Росс%я может напасть и на неё на Болгарию, а так Болгария полностью поддерживает Украину	1
67	если пишут в интерете вам про е*лю , жопу , рот - ни секунды , без сомненья - пишет ватный патриот ??	1
68	конечно. Вам сказали же по телеку,что это зомби вирус ,который через гусей должен был поразить Росси..., случайно поразил украинскую армию.	1
69	Подонак плешивый.	1
70	Мде, п*здyза окончательно скатилась в своём стремление полизать западу, откровенную желтуху постит уже	1
71	конечно, я тоже не верю. У россиян нет альтернативы, они обречены принимать Россию как она есть. В украинцев по-другому...Тут важно, что у РФ не сможет обеспечить достойное существование Белоруси и тем , кого оккупировала. Жители Крыма, Донбасса и если будет, то оккупированной части остальной Украины будут ясно понимать в какую жо пу их втянули и что оно им нах уй не нужно. Режим будет стараться держать всё под контролем и РФ станет ещё худшим конц-лагерем.	1
72	Где Монгайт? Где Фишман?	0
73	Вести из Китая ближе Я вижу Начинается история та Сибири Китай раздаёт паспорта Пение Дзин и первый свисток Паспорта Китая держи Дальний Восток Защита подданных - первый этап Суживаются глаза мам, детей, пап Якутия, Эвенкия, Ямал Прирост Шина таки йоу не мал Япония не отстаёт Курилам Камчатке свой Док раздаёт Pашка сжата до внутримкадья Потом вообще до кремля Единой Планеты Сёстры и Братья Летит летит песня моя Единства чудесный пир Всё Великим Путём В Лад и Мир!)))))	1
74	в комментах одни боты... ни одного коммента со смыслом, манямедуза типа этого не замечает...  джонсон начинает разочаровывать, за оружие ему спасибо для украинских патриотов, но БЕЗ ВОПРОСА ОБ УНИЧТОЖЕНИИ ПУИНСКИХ ФИНАНСОВЫХ ГРУПП НА ЗАПАДЕ И ЛИШЕНИИ ИХ НАВСЕГДА ВОЗМОЖНОСТИ ТАМ РАБОТАТЬ, ЖИТЬ, РАЗМНОЖАТЬСЯ НИКАКОЙ ПОБЕДЫ НЕ БУДЕТ.  путинская мигрировавшая на запад элитка должна быть уничтожена..... и то что это никто из таких как джонсон не обсуждает только подтверждает что этот вопрос - основной для победы над чекистами.	0
75	за пятерку по химии могут обеспечить дополнительные 10 лет	0
76	Вата tупая 🤣🤣🤣	1
77	Ее никогда и небыло, украина это кромка, если представить большую тарелку это краешек этой тарелки, а с 1991 года то что вы завете украиной, это сепаратисткая территория, так как даже на законадательном уровне они не удосужились оформить,  развод територии, а про осьальное уже и говорить нечего	0
78	гордиться нужно исключительно талантливыми людьми, а не местом их рождения/проживания.	0
79	не советские, а царские, но все равно этот термин появился во второй половине 19 века.	0
80	беженцы Украины ещё до нападения России были и в Европе и России наверное	0
81	с каких пор опрос превратился в политику? Вот если бы они там политическое обращение подписывали, и то это не политика. И потом, шахматисты не люди? Они не имеют права высказывать свою точку зрения?	0
82	это все сказки и пропаганда. Ничего подобного не будет, ты если не дурачок, должен это понимать. Репараций тоже не будет, потому как Ро.сия для этого должна проиграть, а это невозможно. Возможно не будет победителей и все это затянется на года. А время пройдёт и появится что то новое, может Тайвань или еще что и года через два, все забудут про Украину, ПРОСТО БАНАЛЬНО МИР УСТАНЕТ ОТ ЭТИХ НОВОСТЕЙ ПРО УКРАИНУ И ВЫ ОСТАНЕТЕСЬ ОДНИ.	1
83	дeбилкa, украинская сторона множество раз пыталась организовать коридоры, но машины попросту обстреливали. Откуда берутся подобные дети шлюx? Вас мамка слишком часто роняла?	1
84	Когда редис падёт, придётся построить много тюрем, для солдат, рос. гвардии, этих мразей из прокуратуры, и прочего военного и преступного мусора	0
85	Ужас. Что зааааа безобразие с поцелуями !	0
86	Плешивый еше и не то устроит..Либердрысня,можете плясать-шиза плешивой сykи перешла все границы...	1
87	я все понЯл - географ все- таки пропил глобус!	0
88	им ещё и оружие выдают	0
89	и кому сейчас не ясно что такое как с украиной можно делать только если сама элита украинская  не хочет рисковать? кому не известно что семья байденов - и сынулька и папаня- коррупционеры ? и занимались коррупцией на украине....  поэтому помогать украине никто не будет... копеешные взносы и старьё оружейное? при этом ярды путину за ископаемые? что вам ещё неясно?  а нае*альное быдло тем более  вам ничего не скажет...	1
90	В общем ничего хорошего не светит нам в ближайшее время..сколько еще так будет продолжаться?	0
91	это вопрос времени. Пропаганда не сможет скрывать правду вечно.	0
92	борцуны ищут работу в швейном цеху у алескея😃	0
93	Вот это хорошие новости😁	0
94	"а не пошёл ты бы ""ваня"" на huy?? https://gosvon.net/?usr=https%3A%2F%2Fvk.com%2Fid716153572"	1
95	"Кому не нравится Дождь-Вы какого чер***а здесь сидите??
Идите к Соловьеву,там смотрите."	1
96	слов нет	0
97	как ушли, также и вернутся, потому что на нашем рынке они делали достаточно большие деньги	0
98	пускай считают , мне от мнения поехавших не холодно не жарко. Проведение спецоперации по ликвидации террористов не является фашизмом.  А вот дискриминация по языку , героизация деятелей нацизма, убийства и похищения инакомыслящих при полной поддержке киевского режима, свободное распространение нацистких символов это конкретно является чертами фашизма или нацизма. Поэтому проведение СВО на Украине вполне оправдано	0
99	бред высрaл, Путин делает все для народа, а Кадыров нас защищает	1
100	...	0
101	Роcсия, страна убийца, агрессор и оккупант.	1
102	Ну естественно это фейк, и вообще это сама Росcия сделала чтобы дискредитировать Европу, да и пожара там не было, это фотошоп всё	1
103	это не вам был коммент ??.. а выше @банутой Надежде Бузмаковой	1
104	старухa, поешь говнa.	1
105	Выдавили из страны, теперь ещё и аккаунты перехватит пытаются? Очень скоро Шойгу, Герасимов, Конашенков и остальные будут умолять о помиловании и говорить о том что всего лишь выполняли приказ, но их настигнет судьба Геринга, Кейтеля, Йодля и прочих военных палачей Третьего рейха. Золотов пойдет по стопам Кальтенбруннера!!!	0
106	ну и сравни. Чувак на допросе явно моложе настоящего Красноярцева.	0
107	петух тебе лучше знать	0
108	мне не интересны твои маргинальные махинации, дyp.	1
109	Россия побеждает . ВСУшники теряют людей и вооружение. Запад модет хоть сколько снабжать оружием Украину, финал близок , нам не за чем с ней воевать и мы не будем этого делать	0
110	"точно. Слабо же потребовать привлеч тех ""кого надо""... 🤣 А этой можно и 50лет потребовать. Не страшно!"	0
111	Кто-нибудь расскажет роcсии, что независимые государства сами могут выбирать в какие союзы им вступать? А, совсем забыл, если это противоречит интересам бункерного шизофреника, то это другое)	1
112	Пи3да паРашке... Впрочем, рабсисяне оплатят йухлу и едрисне все издержки.. не впервой))))	1
113	Вы бы хоть сказали вашим экспертам фамилии поменять, ну правда смех что все эти люди думают о русских.	0
114	Задержали за фамилию три пять	0
115	типа ты бессвязную х@ету несешь.	1
116	Еу чё, пацаны, го 30+ ценз на оружие? Тогда точно заживём, отвечаю	0
117	🤣🤣🤣🤣🤣🤣	0
118	А вам, смерящим овальнятом известно, какие у вас данные даже по ин.агенту Левада центр... 3-4%?? cyku 0вaльHые  на всю голову??	1
119	ох какие санкции серьёзные?? а слабо Свифт отключить= отморозить ушки назло бабушке??? все cyku, koнчались рычаги у изобретателей нацизма и фашизма??	1
120	Они уже за&бали своими санкциями,как будто не знают,то это как укус комара в медведя..??	1
121	надеюсь эти гады получать по заслугам и героев наградят	0
122	я тоже из Питера и сказали, что список засекречен, а все, что в инете пишут, это просто адреса с подвалами, от которых даже ключей нет))	0
123	ок. Отключим ЕС из экономики Р*ссии. Отключим газ,нефть и остальное 🙂	1
124	ты прав, это конкурс ту@ых вопросов и твой вопрос в нем занимает 1 место.	1
125	России то помочь нечем щас сама Росс.я санкции по полной отхватит))	1
126	хихлик, моя твоя не понимайт. Понятно одно, что вся твоя родня на ленинградке стоит и тебя там зачали... а мне это обязательно знать? Но ты точно не с моего племени, у нас в роду отродясь вас хохлячьих бляdeй с двнврии не было. 90% моей родни это потомственные офицеры России.	1
127	Вот это - настоящие русские солдаты.	0
128	абсурд это то, что из-за названия Киевская Русь, украинцы считают Рассию - своей территорией.	1
129	благая идея помощи украине? 🤣🤣🤣🤣	0
130	я про Питер и говорю. 100 километров Эстония от Питера. Спокойно за полтора часа до границы доезжаю.	0
131	Как отреагирует на это вaтники и кремлеботы?	1
132	олимпийские призеры по переобуванию.	0
133	от кого же могли нахвататься...	0
