id	doc	target
354	"""Голосовать против всех - в чем смысл?"" смысл в выборе. против всех - это тоже голоса и тоже процент и его может быть достаточно что бы отменить результаты выборов."	0
355	пропaгaндоновиpyc ??	1
356	А разве цензура - это по сути не фильтрация нежелательной информации?	0
357	@упой путинский тролль строит тут что то	1
358	Донбасс - Россия 🇷🇺 💯♥️♥️♥️♥️♥️	0
359	ты как из палаты сбежал?	0
360	Да че с ней бороться то?? Долларом уже можно жопу вытирать благодаря ископаемому Джо Бидену. Не лидер, а вредитель благополучия Америки. Так же и ЕС, которые себе во вред вводят санкции	0
361	какой же ты задрат	1
362	Все суки кто не доволен собрали манатки и пиздуйте на Украину !! Все вам не так политика не та страна не та пошли нахер вон Евреи заждались трусы вы конченые сидите тут засланные суки какого черта делаете в России если она такая плохая до спецоперации кричали что Россия плохая забыв как тяжело жилось в 90 как началась спецоперация стали кричать вот будет хуже чем в 90 вы уже определитесь ушлепк) так вам когда всё-таки было хорошо !!	1
363	Это так Роcсия защищает русский мир?	1
364	волнует то, что желудок останется голодным, чтобы какие то упыри наслаждались бойней в соседней стране.	0
365	Разговор двух дедов за столом с домино )	0
366	Киев и США воют на Донбассе	0
367	Но лживые пропогандисты Скабеева и Соловьёв, смотри не перепутай овощ	0
368	Ахмат — сила!	0
369	Российская власть - самый большой фэйк и фэйл в одном лице.	0
370	не скули, клювоносое ветхозаветное г.овно из Бабьего Яра.	1
371	"""Мы попадем в рай, а они просто сдохнут"" - Наши танки попадут в рай, а азовсталь сдадут на метал. Слава Россuи 🇭🇷"	1
372	 не приплетайте сюда РБ. Это ложь.. за марадеров, я не отвечаю ,у вас своих хватает красавцев ..и почему я должна верить вам..	0
373	А че у вциома новый гендир, куда куртизанку Пyтина Фёдорова дели?	1
374	Россuя всегда готова для честного диалога.. . ?????🤣 ха-ха	1
375	Жесть ботов)	0
376	происки украинских террористов???	0
377	от СПб, где я живу, 4.5 тысячи км до Байкала, так что смотреть еще надо, откуда кому ехать	0
378	он уже 22 года закрывается , все закрыться не может	0
379	"сволаче укропы едят детей! Азов вообще нацисты, пофиг что что там буквы ""И"" и ""Н"""	0
380	естественно.Если расклад верный,то  очень не выгоден поддерживающим хохлов	0
381	Вот и всё..	0
382	а туп2х совков уже  не научишь - дебильность не лечится.	1
383	вы доброволец?	0
384	такие ибланы, как ты, и должны жить в г@вне... ??	1
385	гнилая власть это не причина гнилой страны, это следствие гнилого народа, это если коротко. Эта искусственная раса людей была создана для жизни в замкнутом пространстве, она не предназначена для жизни в цивилизованном обществе, поэтому, Россия никогда не станет цивилизованным государством, она будет вечным изгоем , пугающим мир своей ядерной дубиной.	0
386	Жаль что такие идиоты подрастают... Он даже не мог отличить нацистское приветствие от удара в грудь...	0
387	Путлер опять врёт, в принципе ,как всё 22 года.	0
388	стропы поправь , овощь .	0
389	🤣🤣🤣🤡	0
390	"Русофобы поменяли свою тактику ! Теперь русофобы пропагандируют россиян выступать против войны на Донбассе, крича во всё горло: ""что и Киевская Власть, что и Кремлёвская Власть - все эти Власти своло@и и хотят только одного, уничтожить свои народы"" !!! Ахахахахаха!
Русофобы забыли наверное - как много было убито русских жителей Донбасса батальонами украинских нацистов в 2014-2015 годах !!!
Ловкая тактика, понимаешь ли ...
Ахахахахаха !!!"	1
391	вы из Рoссии? Радует, что кто-то из россиян осознает это	1
392	и хайль ...уйло кричать будут?	1
393	старая nugapacka, твоих братков бандеровцев уже танками давят и фарш размазывают по земле. Ты способствовала этой войне. На твоей совести смерти твоих братков будут, твapь хохлодырая	1
394	под постами о «Москве» вчерашних с вами бы не согласились )	0
395	зомби есть зомби. Поэтому они всегда хотят мозги, потому что свои згнили	0
396	наxyй сходила, отупелая шваль? Зачем вернулась? ??	1
397	Неееет, тут нет обеих надписей 😭	0
398	Свиногой,ты попутал,речьидет  о сцаной руцне,как твоя мамка.Она ещё жива,байзэвей?))	1
399	"ту х..ню , вменяемый человек может смотреть только как Алекс из ""Заводного апельсина"" на пролечке , в смерительной рубахе и с прищепками на веках."	1
400	ну а за в*йну платишь ты ??	1
401	ну они официально считали, да. Скоро наконец-то перестанут.	0
402	"а зачем? не я ее публикую. Если написал ""а"" , то пиши и ""б""  куда летело над каким местом сбили и куда упало сбитое , и не сбитое тоже."	0
403	"Кто нибудь может напомнить когда Российская власть брала на себя ответственность как факт за что либо?

Как nuzgec, так это не они

Очереди в самой Росcии в метро в 2020? Не, не Собянин, а люди виноваты

Рубль рухнул? Не, не Путин, а злой запад виноват

и так постоянно

Ну ё п т а 😆"	1
404	не слишком многоходовочно?	0
405	конченый еб@нат, как тебя земля носит	1
406	скули выблядoк поганый ??что тебе ещё остаётся, пидop?	1
407	"тебе делать нечего? 
Аккаунт как аккаунт. Недавно в ВК. Цукер забанил, сука проукраинская. Все они сукu пиндосские. А на своей платформе легче, но припрется какой-нибудь Женя поприкапываться."	1
408	будущая карта бывшей россии от всего цивилизованного мира	0
409	скрины с дождя со ствоими комментариями.	0
410	согласна)	0
411	Вот с кем надо встречаться и договариваться а не с пешкой клоуном зеленским . Пу.ин точно сможет договориться !	1
412	чой то я бот? Я просто высказал мнение. Ты как дикарь какой то	0
413	да, да, инопланетянами. не путиным же	0
414	давно пора денацифицировать рашку-порашку 😘😍	0
415	один он всё понимает , только cpaть не просится	1
416	ну по ходу дитя тут ты, раз стёб не понимаешь))	0
417	Бл*ди еще те эти Челябинские власти	1
418	мартышка ты	0
419	Цензура есть везде. Почему её не должно быть в Р..ссии??	1
420	Но ведь Киев мать городов русских🤔	0
421	ну конечно же! И судя по твоей картинке на аве, ты это поддерживаешь🤷‍♂️	0
422	пять фотографий - это самое задокументированное?	0
423	👍👍👍👍👍	0
424	я сама в Германии живу. Для меня ваши друзья, если они вообще существуют, не показатель вообще.	0
425	Игорь болтарь - лахтадыр тпой, как пробка... истории не знает ни в зуб ногой... ссср всюду нос совал - в итоге почил в бозе...	1
426	Кому это пидорасс нужен ??  Брянск хуячали ночью ,проебалиись   Зато Предотвратили покушение на хуисосса (  Умно -Умно ??	1
427	Скажите Собянину и Пу..ину спасибо	1
428	падажжите там... ща толян чубайс  перетрёт с кем надо и нормас	0
429	какая чушь.. все как один проститутки лубянские... вахштайн тоже адепт нае*ального	1
430	кроме латвии стран нет?	0
431	Санкции нужно вводить против Зеленского,который мирных людей стреляет !	0
432	"каким образом ""рыпнется""?) Военным? Не смеши мои тапки. Россия давно уже с помощью оружия только защищает свои интересы и ничего более.  А вот экономически... может и ""рыпнемся"". А может и не придётся. Может они сами своими санкциями себе могилку выроют))"	0
433	Андрюша не бздu! Сейчас в очередь будут выстраивать я, чтобы челом бить ВВП! И смени аватарку, уже не первый раз прошу! Не серьёзно!	1
434	"твой обнуленный ""историк"" только с матерными некрофильскими частушками хорошо знаком, шл.ха ты пригожинская."	1
435	готовьте наши границы	0
436	лошина очкодавная тупая...  покуда я не увижу вереницу возвращающихся  на перекладных золотых деток со слёзками на откормленных е*альниках с российским паспортом в зубах - мне эта вся куйня не интересна.. и покуда я не услышу, что им запрещён въезд обратно  в их сказку наяву - я не успокоюсь и буду везде это писать... как там живётся товарищу скрынник во дворце во франции с детишками? или как там живётся в альпах товарищу коху? всё как в сказке...  а ты лох тут за копеечку корячишься... животное.  да и доченька навала дарьюшка прекрасно себя там чувствует не правда ли? молчи проклятый подонок...	1
437	он имеет ввиду, что если хaxлы слишком долго будут брыкаться, придется уе6ать тополем по житомиру. Пиндoсам в разговоре с япошками это помогло, япошки до сих пор лижут им aнус. Минус житомир, зато вопрос закроется.	1
438	будем слушать мерзких жиных анимах! Держи в курсе, никуда не уходи.	1
439	Ахаха клоуны!!! Е...альники откройте свои  чтоб страна знала вас героев!	1
440	"ещё вроде как ""министром обороны ДыНыРы"" был"	0
441	и причём тут Индия с Китаем? Многие страны сотрудничали с нацистской Германией, но это не сняло с Германии ответственность, и репарации Германия выплачивала 80 лет)	0
442	так пIдар тут только ты, причём обосанный обрыган, к тому же ??	1
443	не в Дагестане.	0
444	тебе то ни один , xpeн? Или рассчитывал из Тернополя в Москву переехать?	1
445	да п...тин его запугал	1
446	а в месте с ней и Росс9и ,и никого на этой планете не будет. На том свете уже ручкой помашете виновникам	1
447	ну россиянских тbарей, если тебе так легче.	1
448	...это что-то о распятых в трёхлетних трусиках мальчках.	0
449	Неожиданно  На фоне Газманова, Любэ, Безрукова и Поречинкова  Молодцы👍	0
450	Этот клоун сейчас фигура номер один на политической арене. К нему, даже не смотря на опасности войны, едут руководители всех развитых стран, оказывают поддержку и помощь. А нашего пыню из под шконкм доставать никто не хочет, заблокировали со всех сторон и руки не подаст даже тот,кого он эти двадцать лет кормил, даже его же купленные нацики вроде лепен отвернулись от этого стратега недоделанного. А сами россияне заняты исключительно вопросом насущного выживания в условиях нaeбнувшейся из за пыни же экономики. А ты чё то смеёшься тут, недоразвитый. Там на Авито набирают воевать за пыню, а ты на диване сидишь, опущенец	1
451	"Русофобы поменяли свою тактику ! Теперь русофобы пропагандируют россиян выступать против войны на Донбассе, крича во всё горло: ""что и Киевская Власть, что и Кремлёвская Власть - все эти Власти свoлочи и хотят только одного, уничтожить свои народы"" !!! Ахахахахаха!
Русофобы забыли наверное - как много было убито русских жителей Донбасса батальонами украинских нацистов в 2014-2015 годах !!!
Ловкая тактика, понимаешь ли ...
Ахахахахаха !!!"	1
452	Вот это ниxyя себе Путин вaту переиграл??	1
453	ну конечн бюджет	0
454	правду пишет молодец, пусть гниет запад	0
455	сложно наверное без мозгов жить 😂😂😂	0
456	а может ты раньше в очереди стоишь  ? Не задавался таким вопросом ?	0
457	Росія терорист! Россuя терорист! Russia terrorist!	1
458	фамилия не русская просто.	0
459	"я расистом назвал конкретно ТЕБЯ, долб*оеб, а не всех ""украинцев"")"	1
460	дура тебя родила, вам бы потомкам Шарикова трубы перевязать, чтоб не размножались	0
461	Верим , верим , не п.здеж ??	1
462	Не, ну ужe доказали, что эта лживaя, менструирующая мрaзь оклеветала Деппа, хотя в самом начале я ей верил.	1
463	А на что рассчитывали? Что Европа кинется на колени, когда климатическая зима у них уже завершилась? Толи ещё будет! Посмотрим какие ценники ЖКХ теперь выставит для населения России за газ, деньги за «потерянную выгоду» непременно забьют в цену реализации - на внутреннем рынке!  Скоро будет выгодно топиться дровами и иметь печь! Граждане России должны понимать, одну главную вещь, они всегда будут оплачивать амбиции и ошибки власти !)))	0
464	Послушал, ничего нового. Всё по-прежнему так же неоднозначно.	0
465	"1.Буча, видео одного из главарей киевской террористической обороны по кличке ""Боцман"" (это бежавший из РФ в сальный Рейх нацист, если кто не помнит). На нем мы отчетливо слышим следующее:    - Вон пацаны без синих повязок, можно по ним стрелять?  - А то, бл*! (видео есть)"	1
466	не истерите	0
467	Слишком дeгенеративная тема для обсуждения.	1
468	что ты можешь противопоставить ему интеллектуально? Свою жену больше похожую на 6лядь в розовом платье...?????	1
469	Шах и мат, шахматисты е два - е четыре	0
470	Щас какой нибудь вор в законе выкупит, будет дырявые гoндоны кремлеботве продавать:)	1
471	закрой своё е*ало	1
472	тебе разве что бутылку под хвост.	0
473	Гори гори ясно	0
474	воистину!	0
475	потому читать отчёты научитесь, не доказано ничего. Даже в ЕС не все поверили в вашу чушь и затребовали доказательств, что так удручило вашего президента. Росcию невозможно выгнать из ООН, можете это тоже вашим властям передать, а то глупые какие то.	1
476	семь миллиардов человек в мире исчезновения россии могут не заметить.	0
477	это и есть втягивание Роцсии в конфликт	1
478	"Немного символизма.  Ровно 110 лет назад, в ночь с 14 на 15 апреля 1912 года, в Атлантике, по пути из Саутгемптона в Нью-Йорк, натолкнувшись на айсберг затонул крупнейший на тот момент пассажирский лайнер «Титаник»  510 российских моряков с ""Москвы"" отправились на концерт Кобздона к 9 мая ??? ВСЕ???"	0
479	Его судить в гааге надо как и всех остальных пропагандонов наших	0
480	zaлупа южноуральская , хватит бредить.	1
481	снаряд в очко и вперёд на фронт, дебилкa.	1
482	ставь лайк, если путuн и сам прекрасно справляется с расколом российского общества	1
483	id512734700|Вячеслав],пошел наxyй отсюда	1
484	а вы смешной, лепите все в одну кучу без разбора. Хотя чего ожидать от фэйка с картинкой на аватарке.	0
485	В масках, чтобы не отп@или ненароком.??	1
486	что пидop вонючий, корежит? ??Страдай, мpaзь eбaная.	1
487	А что здесь у всех медузоботов тема пиdоров чуть ли не в каждом ответе на комент?	1
488	кто мешает Россиu использовать Точку У?	1
489	Почему западные разведки вбросили враньё про неминуемое вторжение, а про признание ЛДНР скромно умолчали? За кого они держат мудрых украинцев? Так ещё и ввели над Украиной бесполетную зону… А могли бы сделать из остатков Украины витрину западного мира… не захотели. Настоящие партнеры так себя не ведут.	0
490	Ждём, Миша. Дождь живёт пока есть ты)	0
491	не всегда так было, уважаемый.💁Это пошло с большевиков, когда русский народ стал народом-угнетателем. Очешуеть можно - народ, проливающий свою кровь для защиты и покровительства других народов, оказался в олночасье угнетателем. Такие дела. Да, а ещё Росси. в совке была самой бедной республикой. Мы кормили всех этих мастурбеков, строили им республики, заводы-пароходы, а в итоге они нас и выгнали потом оттуда.	1
492	"ну да, ""они говнo едят, а мы просто обмазываемся, так что всё нормально"""	1
493	"некролога не надо!

Надо, чтобы наши дети не воевали....скрежет зубов войны звучит со всех зомбоящиков Роcсии!

Что же мы натворили с соседями..."	1
494	Ты идиот? Есть реальные запи с камер, где русские военные упаковывают эти посылки. Все уже доказано	0
495	за щеку взяли путинские когда орали что Киев за 4 дня возьмут, смерись ты родился в стране где сосать вы всей семьёй готовы , так что рот шире и глотай глубже и не пиши хуйн..., сын повии 🤣🤣🤣🤣нищие уроды, умора	1
496	Хоть так.	0
497	то есть если не сказал на стенд-апе то, о чём не хочет - трусливый чухaн?)	1
498	Игорьболтарь кадр из хорошего кино испоганил... вы, холуи позорные, чего не коснетесь - все изгадите... Холопы и холуи - паразиты на теле страны  . А волноваться надо тебе... скоро ж0пу свою наждачной бумагой будешь шкрябать:) Игорь ака наташа фром раша :) https://m.youtube.com/watch?v=M3c8uHcpYpM&t=3s	1
