id	doc	target
1078	ну во-первых извинится перед народом украины и зеленским. Что было бы неплохо. Покаяние - шаг к примирению. Тем более ввп поощряет традицию извинений всяческих.	0
1079	"Зомбакам пруфы не нужны. Просто скажи им ""весь мир против Россиu"" и им этого достаточно."	1
1080	50 дней выжидал..	0
1081	Почти сто лет назад в одной стране, подонок и негодяй захватил власть, одурманил народ, пробудил в нём низменные чувства захватничества, злобы и ненависти ко всем остальным народам и на этом фоне попытался поработить весь мир, за это преступление человечество заплатило 80 миллионов своих жизней, как в страшном сне история повторилась до мельчайших подробностей, только вот цена за это повторение будет несоизмеримо большей и затмит своим трагизмом все преступления Гитлера. Гордись, Р***ссия, в этом тебя уже никто не превзойдёт!	1
1082	очень хорошо	0
1083	кто-то из РФ заявлял о том что спец.операция будет 3 дня?	0
1084	После этого будут nuzgeть о дестабилизурующем влиянии запада на обстановку внутри самой России?	1
1085	зато правда	0
1086	"Это говорит в какой ж#пе живут ""освободители""??????. А успешную карьеру в армии построил перекуп ????"	1
1087	Кем востребован пУтриотизм?  Назовите их!	0
1088	мальчик остынь, я ничего такого не сдалала) Зато я знаю кому место рядом с всякими оппозиционерами уже подогрето, - половине украинских мэров - нацистов, всем члинам ФБК и оппозиционерским выскочкам)	1
1089	Нахpена вы всё ещё пишете этот дисклаймер?	1
1090	лет через 10 наверное и украинцам будут давать героя России 😂	0
1091	рот закрой укронацистка	0
1092	Да просто можно тверскую область обкатать и все. На пару недель там достопримечательностей точно хватит. Озерки, Тверь, Бологое... Сам бы сгонял	0
1093	да да сейчас с 30 марта  уже и  миллиард имеет . Инфляций👍	0
1094	Что нового ? Они уже там 8 лет находились	0
1095	Вот Украине сейчас больше нечего делать, как стрелять по селам, смешно	0
1096	если их нaxyй не послали, а они добровольно съехали, то смею предположить, что не такие уж были светлые умы.	1
1097	мне и здесь хорошо. А что, разве где-то соврал?	0
1098	Собчак и Навальный не работают на обрушение мировой безопасности.	0
1099	русские бывают и не инфицырованные. Я не знаю лично таких, но слышал, что они есть.	0
1100	Я как бы не хочу сказать, что мародерства там не было. Но нафига аккумуляторы-то?	0
1101	"я вообще не сомневаюсь даже, что в штыковую на ВУЧек идти не будут. Все в штабах прекрасно знают, что в российском обществе любят победы, но уже абсолютно не любят гробы. Когда наступит тот ""день z"", то, если потребуется - применят крылатые ракеты, чтобы устранить любую опасность. И будут идти только на противника обращённого в бегство, либо легко окружаемого. Вероятность гибели наших солдат очень минимальна."	0
1102	id3340274|Людмила],ну кидалиж уже видос Ну не позорься маня Ну калибр это ваш И не подбитый а в цель летящий Ну научите уже ваших бомбардиров прицеливаться без доводки или ракету в молоко уводить,если БПЛА доводящий её до цели сбили перед этим	0
1103	раньше я был против цензуры, но изучив матчасть того как устроена свобода слова я понял что советская цензура была чуть ли не совершенством в плане фильтрации гoвнa.  Ее не надо было ломать, только совершенствовать.	1
1104	Хохлушки шлюшкu	1
1105	каким образом шпионы должны подтверждать ваше заявление? Продемонстрируйте причинно-следственную связь.  И какое отношение шпионы имеют к ФСБ тоже неплохо было бы пояснить	0
1106	6JIя, очередной российский пёс сидя за фейком что то nuzguт не имея ответственности за свои слова  Герой, ты бухим хотя бы не заходи в интернет ??	1
1107	наверняка это какое-то спец подразделение, поэтому и в масках, когда в госпитале награждают, то все лица открытые…у приматов ума не хватает сделать элементарный анализ	0
1108	были бы патриотами поддержали бы спецоперацию	0
1109	Я веду оппозицию у себя на странице  Прошу прокомментировать вашим мнением	0
1110	"как сказал классик "" любить ты можешь пезды или жоnы, но думать должен головой"""	1
1111	на пикабу посты о восхваление Рамзанки на фоне Урганта 😂	0
1112	всегда должны быть осторожны.  На всех массовых мероприятиях с большим количеством людей	0
1113	только там где шли бои это есть. В Бердянске нет. В Мелитополе тоже. И т.д.	0
1114	ты не была ни в одной из этих стран, ничего про них не знаешь, ни про экономику, ни про жизнь обычных граждан, ни про их врагов. У Китая например куча врагов по периметру. Тайвань китайский Крым.	0
1115	первый раз такое показали, Блинкин за это по голове не погладит)	0
1116	Терри Гиллиам может взять за основу подобный пиз дeц и снять очередной кинотрeш.	1
1117	Раньше только преступники были в масках, а сейчас все. Не поймёшь преступник или герой....	0
1118	Ну... Я хочу быть на стороне морали, на стороне своей совести, а не на стороне победителей. Поэтому, да. Я умру второсортным, но я умру спокойно, зная, что не поддерживал резню. Что ж. Ты довольно честно ответил. Это похвально. Не смею осуждать тебя, что ты хочешь быть на стороне победителей. Мотивы понятны. Но я все же хочу умереть честным со своей совестью.	0
1119	Потом ещё раз спросим про границы 97 года. Выведем в явочном порядке если не поймут демонстрационного избиения бандеровцев.	0
1120	Если вы считаете, что Точку-У на Краматорск запустил Пуин, то это не значит, что вы плохой человек, вы хуже.	1
1121	не каждое неразумное одноклеточное существо является ботом)) есть просто очень тупе люди 🤓	1
1122	везде этой хернёй ср%ть будешь, хохлинка?	1
1123	вот вот, я тоже не в восторге от происходящего, но раз уж так произошло, то есть два факта: 1. Это моя страна и я буду на ее стороне 2. Как бы тщательно ты не вылизывал зад, западу и украинцам, своим ты там все равно не станешь	0
1124	фейк рассказывает о фейках, в качестве аргумента прикрепляя фотку канистры, которую якобы выложили российские сми. Рос СМИ, наверно, сами не знают, что они это выложили  Не удивлен, что такие же фейки это всё и лайкают. Вот так в комментах на лентаче и пытаются промыть мозги детишкам	0
1125	дур7ак или оплаченая сволочь	1
1126	Это те которые из-под Киева сбежали? Под трибунал!!!	0
1127	😂	0
1128	гоbно фейки.	1
1129	либерасты честные..потому они все нищие..питаются только отходами моря( омары)	0
1130	"Но почему то РосСМИ не публикует информацию о том, что Рассия помогла этой бабке с переездом в Россию, продоставлении ей жилья , гражданства, пенсии, материальной помощи и прочего блага!
  Но чисто по русски - использовали один момент из её жизни попиарили себя и Россию и ... успешно её забыли, не забывая до сих пор использовать её в своих пропагандистских целях.
И НИ ОДНОМУ россиянину, который тут ""восхищается"" это бабусей, и в голову не приходит мысль пригласить её к себе и позаботиться о ней! НИ ОДНОМУ!!!"	1
1131	плохо с историей или с математикой?)	0
1132	"Свободные люди из ДНР и нацисты в Чехии это в голове в того п..тина, что ""я не повышу пенс возраст"", ""я не поменяют конституцию"", ""срочников там нет"" и другие перлы вранья, или того п..тина который воображаемый и что то там ""гордость людей поднял"" и прочие бредни платных патриотов?"	1
1133	Читал, что даже Соловьёв аxyeJI от ситуации и потребовал от минобороны обьяснений	1
1134	💙💛	0
1135	"Какая хорошая тема Украина! Любые проблемы в Россuи за ней можно спрятать! Даже короновирус ""бендеровцами"" разбит!"	1
1136	Ничего не будет, запишет гневный ответ. Тиктокерские воены они такие...	0
1137	так во время Нюрнбергского процесса определили, как причастных, так и главных виновников.	0
1138	Это всё уже не поможет системе Путина 😹🖕 для Путина отдельно будет создан ПРОЦЕСС, НЮРНБЕРГСКИЙ ❤️ Германия кстати предлагает россиянам настоящий Нюрнберг для этого и свою безукоризненную юстицию:) только притащите это чучело к нам🔥🔥🔥🔥🔥	0
1139	хватит скулить!	0
1140	 «Подпись Неразборчива», бл*, ну что за деб@лы? 😤 И так в России везде, в армии тем более	1
1141	 у вас день открытых дверей в дурке ?    Кто начал обстрел ЛДНР ?  Сколько можно убивать людей. Всё правильно сделал Путиh.	1
1142	Думаю, Украина может согласиться на перемирие. Для этого П..тин должен встретиться со Степаном Бандерой и подписать соответствующий договор	1
1143	ещё одна свыння порвалась 🤣	0
1144	пи3дeц бандерлогам	1
1145	а при чём здесь навязывание демократии США к русскому фашизму?	0
1146	ооо, Лахта 2 на работе? Что страница то такая подозрительная? Когда засветить успел то?😂😂😂. У вас там ещё требуются лахтари?	0
1147	суждение ин агентов как блеяние собаки, никому нахре... не интересно)	1
1148	только вот в Мариуполе треть школ русскоязычных, и только с 2019 года первоклассники начинали учиться на украинском языке. Столько денег вкладывают в прапоганду, а слушать не возможно.	0
1149	Унылый клоун) Понял, что обо(с)рались и взгрустнул??	1
1150	"ничего страшного не будет. Просто скакуасы испытают сильные имперские фантомные боли по потерянным территоиям. И не более того. От этого не мирают.
 ВСУчки тоже останутся живы, если согласятся мирного покинуть обе бывшие области."	1
1151	пиздежь	0
1152	Вам это не напоминает лето 41-го года? Тот же цинизм, то же лицемерие и та же ложь, всё повторяется....	0
1153	хахаха, вы сделали мой день 🙈😅	0
1154	id140797226|Егор ]- кремлядь 😊	0
1155	а ты прям герой, ПУТриотик, с закрытой странищи ещё и заблокировал, сыклище..!👍🤣🤣🤣	0
1156	нае*альный шланг	1
1157	Да потому что он сам хохол 😂😂😂	0
1158	Zalupi V maskakh poluchiayt Znachki Za VZiatie Za sheku. Troekratnoe P?tin khuylo??????	1
1159	Маша, беги!	0
1160	"Я вспоминаю старых советских героев! То ли дело ""Берегись автомобиля""!?"	0
1161	ты список сотрудников твоей ботофермы достал?  Давай, поторопись, в этой гонке нет второго места. Или ты амнистию не хочешь?	0
1162	абсолютно плевать на украинских беженцев и их проблемы! Есть интересы Рoссии - заставить украину отказаться от нато, признать Крым и ДНР с ЛНР, обеспечить водой из Днепра Крым и эти задачи должны быть выполнены. украина - это угроза национальной безопасности Рoссии, это образование, которое танцует под дудку сша и запада, открыто ведет враждебную Рoссии политику. И что я должен после этого жалеть украинцев? они сами выбрали путь вражды с Россией, так что получают то, что заслуживают! Россия должна сломать украину, унизить ее и ее население военным поражением, заставить подписать унизительный мирный договор и навсегда положить конец той угрозе, которую украина несет нашей стране! И для этого все средства хороши, даже применение ядерного оружия! украина и запад в 2014 году объявили Рoссии войну, вызов принят! а такие как ты льют воду на вражескую мельницу пропаганды!	1
1163	в таких не состою.  Группы троллей и ботов в вк не нужны	0
1164	Наконец то, Борис перестанет сс1ть в подьездах РФ	1
1165	стебешься?😳😳😁😁😁😁	0
1166	мой хер в жопке твоей мамке, потом оближешь..)))его	0
1167	Всю элиту обратно на родину и их семьи! Учиться , лечиться , отдыхать в Рос)ии!!!	1
1168	"и как это бьётся с тем, что трупы лежали две недели? 🤫

Свидетели путаются в показаниях. Это наводит на мысли...

Подозреваю, что у тел ""со связанными руками и белыми повязками"" флешетов не окажется, окажутся просто пули. 🤷‍♀ И тела будут свеженькие.

Было бы прикольно, если бы было беспристрастное следствие. Но пока мы видим, что этого нет и в помине. Но нам не привыкать)

Как говорил мой учитель по дзю-дзюцу: ""если юкко: значит - бей"". В смысле если засуживают и дают очков меньше, чем справедливо, просто побеждай нокаутом, чтобы ни у кого не осталось сомнений. Так Роcсия поступит и в этот раз."	1
1169	Млять а иностранцы узнают что я их агент или об этом знают только путиh и роскомнадзор?	1
1170	Сыкуны	0
1171	совсем свеженький лахтапитта?ок?? Заноси меня в чс скорее??	1
1172	"ну так и сейчас такая цель в отношения Донбасса!Угроза Донбассу исходит из Киева,там ген.штаб,все руководство.Тбилиси не стали брать и оставили проблему прозападную Грузию которая не дай Бог ослабнет Россия пойдет возвращать ""свои"" территории.Надо рубить под корень!"	0
1173	стоп .где сказано ,что их эвакуируют?кто их эвакуирует?я живу на границе с украиной ,отсюда тоже много уехало в другие города России,дальше что?	0
1174	"да, похоже на то, что в Украине не украинская, а прозападная власть. А Запад в сговоре с Пути*ым, второй раздел Украины проводится. ""Санкции""-то ради приличия введут, иначе будет совсем скандал.

Украинская (действительно самостийная)  власть ввела бы военное положение. А эти -
турчиновы и зеленские - всё ""дипломатическим"" путём ""решают""..."	1
1175	Контора пидapacoв получила по заслугам	1
1176	И зачем тогда НАТО если ничего решить не может.	0
1177	Вот стопудово не было, сказали стрелять - но не стреляли, зуб даю. А потом фото трупов с белыми повязками (символ Росси..) и вой на весь мир.	1
1178	"в Рос(с)ии все ""за"". только я не пойму, тебе это как поможет?"	1
1179	это злонамеренная диверсия. Типографию всю к стенке!!!	0
1180	зачем, с бюджета за счёт населения всё компенсируют.	0
1181	радио ЖыДождь👎🤢	0
1182	Историю пытаются переписать страны запада, а не Путин! не путайте! 🤔	0
1183	да хотелось бы. Но зеля наркоша и уже ничего не соображает. Такую хр*ень несёт в массы. И ему наплевать на свой народ, ему лишь бы дозу дали, а там хоть трава не расти.	1
1184	из НКВД	0
1185	слыш ты туарь рот свой закрой. Сама удобрять скоро будешь!	1
1186	ТТвари хохлопердые.	1
1187	нет, он убил владельца ружья, а ещё с ними был отец стрелка.	0
1188	судя по заварошнику для чая в левом ухе, его юля не интересует, а вот ейный муж...	0
1189	Sexy - вонючка пустоголовая;)	0
1190	Совбез оссии запросто может привести к звездезу твоей родины и ни одна бл..ь не заступится . Если конечно плохо себя поведут твои лидеры .	1
1191	👇вот ваше поколение..	0
1192	Простой, да не простой	0
1193	"Не тот вопрос. Формулирую: 1. Нужно ли нам (россиянам, России как государству) решать проблему Донбасса?  2. Если на вопрос 1 отвечаете ""да, нужно"", тогда:   - Каким способом нужно решать проблему Донбасса  - а) силовым или б) мирным?  Если кто-то отвечает ""б) мирным"", тогда предлагаю такой вариант:  - раздел Донбасса на две части: ""украинскую"" и ""русскую"" и включение ""русской"" части в состав РФ за ВЫКУП - по договору с Украиной.  (При этом до достижения договоренности по этому плану сохраняется нынешний режим на Донбассе.)"	0
1194	зачем дядя володя так близко к роялю подошел?	0
1195	про хохла это ты красиво завернул))))	0
1196	а как быть с первой брачной ночью?	0
1197	ему уже туда швабру запихали на полметра	0
1198	Поганaя мрaзь.	1
1199	довольны будут китайсы, трахая тебя и семью твою В ЖЖОПУ	1
1200	в абсолютно любом госудасрстве есть преступность, наркомания и т.п.	0
1201	Разумно,теперь можно денег у путuна просить на содержание депортированных с Донбасса	1
1202	жидня за твою .опу дальнобойщики дерутся, беги на смену 😄🐓	1
1203	А до 2027 будут за рубли покупать?)) Да и хорошо 😂😂 Мне кажется Р***ссию это прекрасно устраивает))	1
1204	они не стреляли.они стоят на границе в ростовской области	0
